{
  "meta": {
    "title": "🇹🇭 Thailand",
    "flagEmoji": "🇹🇭",
    "breadcrumbName": "Thailand"
  },
  "identity": {
    "category": "Country",
    "name": "Thailand",
    "nativeName": "ราชอาณาจักรไทย (Ratcha-anachak Thai) / Kingdom of Thailand",
    "tags": [
      "Southeast Asia",
      "ASEAN",
      "Upper-Middle-Income",
      "Export-Oriented",
      "Constitutional Monarchy",
      "Manufacturing Hub"
    ]
  },
  "definition": {
    "text": "Thailand is a constitutional monarchy in Southeast Asia with a diversified, export-oriented economy. Historically the Kingdom of Siam, it avoided formal colonization and underwent gradual modernization in the late 19th and early 20th centuries. Since the late 20th century, Thailand has developed strong manufacturing sectors—particularly automotive and electronics—alongside tourism and agro-industrial exports, integrated into regional and global value chains."
  },
  "statistics": [
    {
      "id": "population",
      "value": "71 million",
      "label": "Population (approx.)",
      "hasIndicator": true,
      "indicatorValue": 71000000
    },
    {
      "id": "gdp_nominal",
      "value": "USD 540 billion",
      "label": "GDP (Nominal, approx.)",
      "hasIndicator": true,
      "indicatorValue": 540000000000
    },
    {
      "id": "area",
      "value": "513,120 km²",
      "label": "Total Area",
      "hasIndicator": true,
      "indicatorValue": 513120
    },
    {
      "id": "capital",
      "value": "Bangkok",
      "label": "Capital City",
      "hasIndicator": false
    },
    {
      "id": "government_type",
      "value": "Constitutional Monarchy",
      "label": "System of Government",
      "hasIndicator": false
    }
  ],
  "works": [
    {
      "id": "actor_set_evolution",
      "type": "Temporal",
      "status": "pending",
      "title": "Actor Set Evolution of Thailand",
      "description": "Temporal mapping of Thailand’s actor space from monarchical-administrative structures and military influence to export-oriented industrialization, business conglomerates, and contemporary regulatory institutions.",
      "link": null
    },
    {
      "id": "industrial_and_trade_network",
      "type": "Network",
      "status": "active",
      "title": "Industrial and Trade Network Structure",
      "description": "Network analysis of Thailand’s automotive clusters, electronics manufacturing, agro-industrial exports, and integration into ASEAN and global production networks.",
      "link": null
    },
    {
      "id": "regional_spatial_structure",
      "type": "Spatial",
      "status": "pending",
      "title": "Regional Spatial-Administrative Structure",
      "description": "Geospatial representation of provinces, economic corridors (including the Eastern Economic Corridor), infrastructure systems, and regional development patterns.",
      "link": null
    }
  ],
  "footer": {
    "entityCode": "THA",
    "region": "Southeast Asia",
    "lastRevised": "2026-02-15",
    "links": [
      { "label": "About", "href": "../about.html" },
      { "label": "Methodology", "href": "../methodology.html" },
      { "label": "Contact", "href": "../contact.html" }
    ]
  }
}
