{
  "meta": {
    "title": "üáÆüá≥ India",
    "flagEmoji": "üáÆüá≥",
    "breadcrumbName": "India"
  },
  "identity": {
    "category": "Country",
    "name": "India",
    "nativeName": "BhƒÅrat (‡§≠‡§æ‡§∞‡§§) / Republic of India",
    "tags": [
      "South Asia",
      "Federal Republic",
      "Emerging Economy",
      "BRICS",
      "G20",
      "Civilizational State"
    ]
  },
  "definition": {
    "text": "India is a sovereign federal parliamentary republic in South Asia and the world‚Äôs most populous country. It combines a long civilizational history with modern constitutional governance established in 1950. India has a structurally diversified economy spanning agriculture, manufacturing, and a globally competitive services and technology sector, and plays an increasingly central role in Indo-Pacific geopolitics and multilateral institutions."
  },
  "statistics": [
    {
      "id": "population",
      "value": "1.43 billion",
      "label": "Population (approx.)",
      "hasIndicator": true,
      "indicatorValue": 1430000000
    },
    {
      "id": "gdp_nominal",
      "value": "USD 3.7 trillion",
      "label": "GDP (Nominal, approx.)",
      "hasIndicator": true,
      "indicatorValue": 3700000000000
    },
    {
      "id": "area",
      "value": "3.29 million km¬≤",
      "label": "Total Area",
      "hasIndicator": true,
      "indicatorValue": 3287263
    },
    {
      "id": "capital",
      "value": "New Delhi",
      "label": "Capital City",
      "hasIndicator": false
    },
    {
      "id": "government_type",
      "value": "Federal Parliamentary Republic",
      "label": "System of Government",
      "hasIndicator": false
    }
  ],
  "works": [
    {
      "id": "actor_set_evolution",
      "type": "Temporal",
      "status": "pending",
      "title": "Actor Set Evolution of India",
      "description": "Temporal mapping of India‚Äôs actor space from colonial administration and nationalist movements to post-independence state-building, economic liberalization (post-1991), and contemporary public-private institutional configurations.",
      "link": null
    },
    {
      "id": "federal_spatial_structure",
      "type": "Spatial",
      "status": "pending",
      "title": "Federal Spatial-Administrative Structure",
      "description": "Geospatial representation of states and union territories, demographic density gradients, industrial corridors, and regional development asymmetries.",
      "link": null
    },
    {
      "id": "technology_and_services_network",
      "type": "Network",
      "status": "pending",
      "title": "Technology and Services Network Structure",
      "description": "Network analysis of India‚Äôs IT services, pharmaceutical production, startup ecosystems, and integration into global value chains.",
      "link": null
    }
  ],
  "footer": {
    "entityCode": "IND",
    "region": "South Asia",
    "lastRevised": "2026-02-15",
    "links": [
      { "label": "Index Gentium", "href": "https://bremontix.xyz/lab/research/country/" },
      { "label": "Methodology", "href": "https://www.bremontix.xyz/lab/ar/Locus-Instrumentorum/Toolset/Representation/" },
      { "label": "Research Notes", "href": "#" },
      { "label": "Contact", "href": "#" }
    ]
  }
}
